{
  "schema_version": 2,
  "rq_id": "RQ014",
  "run_id": "RQ014_1_wod_rating_recovery_REPLACE_UTC_REPLACE_PLAN_SHA8",
  "operation": "rq014_g2_contract_preflight",
  "git_commit": "0000000000000000000000000000000000000000",
  "formal_g1": {
    "path": "/share/home/u25310231/ZXC/sociality_estimation/code/repo/reports/studies/RQ014_wod_e2e_rating_recovery/01_plan_review/RQ014_formal_G1_v1p5_20260712.yaml",
    "sha256": "0000000000000000000000000000000000000000000000000000000000000000"
  },
  "contract_bundle": {
    "path": "/share/home/u25310231/ZXC/sociality_estimation/code/repo/reports/plans/RQ014_plan_v1p5_checksums_20260712.sha256",
    "sha256": "0000000000000000000000000000000000000000000000000000000000000000"
  },
  "environment_manifest": {
    "path": "/share/home/u25310231/ZXC/sociality_estimation/manifests/RQ014/managed_python_environment_v3.json",
    "sha256": "30de86f702101fbfc8065f6a0d7fd4378daf526d0e55c1197a6a0a147752877a"
  },
  "input_manifest": {
    "path": "/share/home/u25310231/ZXC/sociality_estimation/manifests/RQ014/REPLACE_RUN_ID/input_manifest.g2.json",
    "sha256": "0000000000000000000000000000000000000000000000000000000000000000"
  },
  "sanitization_receipt": {
    "path": "/share/home/u25310231/ZXC/sociality_estimation/inputs/RQ014/wod_rated479_score_stripped/v1/sanitization_receipt.json",
    "sha256": "0000000000000000000000000000000000000000000000000000000000000000"
  },
  "materialization_ledger": {
    "path": "/share/home/u25310231/ZXC/sociality_estimation/manifests/RQ014/REPLACE_RUN_ID/materialization_ledger.json",
    "sha256": "0000000000000000000000000000000000000000000000000000000000000000"
  },
  "declassification_export_receipt": {
    "path": "/share/home/u25310231/ZXC/sociality_estimation/work_dirs/RQ014/REPLACE_EXPORT_RUN_ID/outputs/rq014_g2_declassification_export_receipt.json",
    "sha256": "0000000000000000000000000000000000000000000000000000000000000000"
  },
  "declassification_export_done": {
    "path": "/share/home/u25310231/ZXC/sociality_estimation/work_dirs/RQ014/REPLACE_EXPORT_RUN_ID/outputs/DONE.json",
    "sha256": "0000000000000000000000000000000000000000000000000000000000000000"
  },
  "resource_profile_id": "rq014-g2-preflight-cpu-v1"
}
